<fichas xmlns:xsi="http://www.w3.org/2001/XMLSchema-instance" xsi:noNamespaceSchemaLocation="datos.xsd">
<ficha dni="22222222D">
<nombre>Antonio Machado Ruiz</nombre>
<iniciales>AMR</iniciales>
<edad>22</edad>
</ficha>
<ficha dni="33333333S">
<iniciales>MM</iniciales>
<nombre>Mario Moreno</nombre>
<edad>23</edad>
</ficha>
<ficha dni="44444444F">
<nombre>Ada Lovelace</nombre>
<iniciales>ALO</iniciales>
<edad>24</edad>
</ficha>
<ficha dni="55555555A">
<nombre>pablo ruiz picasso</nombre>
<iniciales>prp</iniciales>
<edad>24</edad>
</ficha>
</fichas>
